Property_ID,BHK,Area_SqFt,Locality,Locality_Tier,Price_Lakhs,Price_Per_SqFt,Property_Type,Furnishing_Status,Construction_Status,Property_Overview,Investment_Analysis,Location_Advantages,Target_Buyers,Total_Amenities,Amenities,Nearby_Features,Selling_Points,Views_Facing,Quality_Score,Quality_Rating,Quality_Out_Of_100,Locality_Avg_Price,Locality_Character,Locality_Description,Ideal_For,Market_Position,Price_vs_Market_Percent,Investment_Recommendation,AI_Model,Analysis_Type,Content_Source,Batch_Number
0,4.0,2250.0,Bodakdev,Tier 1,368.0,16355.56,Apartment,Furnished,Under Construction,"Nestled in the heart of Bodakdev, Ahmedabad's most sought-after neighborhood, this 4.0 BHK apartment offers a rare blend of luxury and comfort. With its strategic location, this under-construction property boasts of easy access to major commercial hubs, entertainment hotspots, and recreational areas. As one of the few remaining properties in the area, this spacious abode provides a unique opportunity for discerning buyers to own a piece of Ahmedabad's premier real estate.","This property promises robust appreciation prospects in an established market. Priced competitively at ₹16356 per sqft, it provides competitive positioning in Bodakdev. The 4.0 BHK layout targets premium homebuyers, ensuring consistent rental demand and resale liquidity.","• Prime residential area with excellent connectivity | • Close proximity to IT hubs and business centers | • Well-developed infrastructure with metro access | • Surrounded by reputed schools, hospitals, and malls",Best suited for large families wanting premium amenities. The 2250.0 sqft layout in Bodakdev's premium setting aligns with their requirements.,10,"24x7 Security, Power Backup, Lift, Intercom, Landscaped Garden, Gym, Visitor Parking, Kids Play Area, Clubhouse, Swimming Pool","Shopping Mall, IT Park, School, Metro Station","Luxury Living, Spacious Layout, Prime Location, Well Connected, Ready to Move","Corner Property, Vastu Compliant",5.03,Fair,50.2,189.7,Premium & Emerging & Spacious,"A high-end residential area, developing area, larger properties","Large Families, High-Income Buyers, Apartment Seekers",Above Market - Overpriced,93.99,AVOID - Poor Quality or Overpriced,Ollama,AI-Generated,Ollama Local LLM,1
1,5.0,3415.0,Sarkhej,Tier 3,366.0,10717.42,Apartment,Furnished,Under Construction,"A well-designed 5.0 bedroom Apartment in Sarkhej, a emerging neighborhood in Ahmedabad. Spread across 3415.0 sqft, this property is available for ₹366.0 Lakhs.","This property promises attractive entry point for long-term investors. Priced competitively at ₹10717 per sqft, it provides competitive positioning in Sarkhej. The 5.0 BHK layout perfect for multi-generational families, ensuring consistent rental demand and resale liquidity.",• Budget-friendly location with growing infrastructure | • Peaceful residential environment | • Easy access to main roads and public transport | • Value-for-money investment opportunity,"The ideal buyer profile for this 5.0 BHK apartment in Sarkhej (Tier 3) is likely to be affluent professionals or entrepreneurs who value privacy, space, and comfort. They may be individuals or families with a high standard of living who are seeking a luxurious home in a prime location without the hefty price tag associated with properties in more popular areas of Ahmedabad. The lack of amenities may also appeal to buyers who prefer a simpler lifestyle and do not need additional features like a gym or swimming pool.",5,"24x7 Security, Power Backup, Lift, Parking, Garden","School, Market","Luxury Living, Spacious Layout, Value for Money, Growing Area, Ready to Move","East Facing, Park View",4.78,Fair,47.8,87.84,Mid-Range & Active & Comfortable,"A well-established residential locality, good market activity, moderately-sized properties","Small Families / Working Professionals, Upper-Middle Class, Apartment Seekers",Above Market - Overpriced,316.67,AVOID - Poor Quality or Overpriced,Ollama,AI-Generated,Ollama Local LLM,1
2,4.0,3150.0,Bhat,Tier 3,365.0,11587.3,Apartment,Furnished,Ready to Move,"Nestled in the heart of Bhat, Ahmedabad, this spacious 4 Bedroom Hall Kitchen Apartment offers an unparalleled blend of luxury and comfort. With a total area of 3150 sqft and furnished with high-quality fixtures and appliances, this property is the epitome of modern living. Located in a secure and peaceful neighborhood, just minutes away from major commercial hubs and entertainment options, this ready-to-move-in property is a must-see for any discerning buyer.","Based on the provided information, here is a detailed investment analysis for the 4.0 BHK apartment in Bhat (Tier 3) with an asking price of ₹365.0 Lakhs:

Investment Potential: The property's location in a tier 3 area offers potential for capital appreciation, as demand for housing is expected to increase due to the growing population and economic activity in the region. However, the high price-to-square-foot ratio may limit the potential for significant capital appreciation.

ROI Prospects: The property's furnished status and presence of two amenities may provide a moderate return on investment (ROI) through rental income. Assuming an annual rent of ₹20,000 per month, the property could generate a ROI of around 6% based on the purchase price.

Rental Demand: The demand for","Bhat, Ahmedabad is a prime location that offers several advantages for homebuyers. Here are some of the key location advantages of Bhat: |  | 1. Connectivity: Bhat is strategically located in Ahmedabad, which makes it easily accessible from various parts of the city. The area is well-connected to major roads and highways, including the Sarkhej-Gandhinagar Highway and the Sabarmati Riverfront. This makes it easy for residents to commute to work or other places within the city. | 2. Amenities: Bhat is home to several amenities that make living comfortable and convenient. These include well-equipped shopping malls, restaurants, schools, hospitals, and recreational facilities. The area also has a good supply of grocery stores, convenience stores, and other daily necessities. | 3. Growth Potential: Bhat is located in a rapidly developing area","The ideal buyer profile for this 4-bedroom apartment in Bhat (Tier 3) is likely to be professionals or families with higher middle-class income levels. These buyers are looking for a spacious and well-appointed home with easy access to amenities and transportation, which makes the property located in a rapidly developing area appealing. The furnished unit and two amenities also add value to the property, particularly for busy professionals or families who want a hassle-free living experience.

The target buyer may include:

* Young professionals working in nearby IT parks or businesses, seeking a comfortable home with easy access to work.
*",5,"24x7 Security, Power Backup, Lift, Garden, Water Supply","School, Highway","Luxury Living, Spacious Layout, Value for Money, Growing Area, Ready to Move","Park View, Corner Property",4.78,Fair,47.8,122.59,Premium & Emerging & Spacious,"A high-end residential area, developing area, larger properties","Families, High-Income Buyers, Apartment Seekers",Above Market - Overpriced,197.74,AVOID - Poor Quality or Overpriced,Ollama,AI-Generated,Ollama Local LLM,1
3,4.0,336.0,Sanand,Tier 2,365.0,108630.95,Apartment,Furnished,Ready to Move,"Nestled in the heart of Sanand, Ahmedabad, this stunning 4 Bedroom + Hall + Kitchen + Dining Apartment offers an unparalleled living experience. With a prime location and ample natural lighting, this property is perfect for families or professionals seeking a comfortable and convenient lifestyle. The furnished interiors boast of modern amenities and sleek designs, creating a harmonious blend of style and functionality. Whether you're looking to invest in a new home or seeking a relaxing retreat, this property is sure to impress.","Based on the provided details, here is a detailed investment analysis for the 4.0 BHK apartment in Sanand:

Investment Potential: The property in Sanand has a good investment potential due to its strategic location and growing demand for housing in the area. As Tier 2 cities like Sanand are witnessing rapid growth, there is an increasing number of professionals and families moving to these areas for better job opportunities and a higher quality of life. Moreover, the property's price of ₹365.0 Lakhs is reasonable considering its location and size, making it an attractive investment opportunity.

ROI Prospects: The return on investment (ROI) prospects for this property are good due to the growing demand for housing in Sanand. With the property's price of ₹108631 per sqft, the expected rental yield could be around","Sanand, Ahmedabad offers several location advantages for a Tier 2 city in India. Here are 3-4 key benefits: |  | 1. Strategic Location: Sanand is located on the outskirts of Ahmedabad, which makes it an attractive option for those looking for a suburban lifestyle without being too far from the city's bustling commercial and cultural hub. Residents can enjoy the benefits of living in a smaller town while still being within easy reach of Ahmedabad's amenities and opportunities. | 2. Affordable Housing: The property prices in Sanand are generally lower compared to other areas of Ahmedabad, making it an attractive option for those looking for affordable housing options. This is particularly appealing to first-time home buyers or those on a budget. | 3. Proximity to Employment Hubs: Sanand is located close to several employment hubs","The ideal buyer profile for this 4.0 BHK apartment in Sanand (Tier 2) is likely to be professionals or families who are looking for a spacious and comfortable living space in a developing area. The property's location in Sanand, which is growing rapidly in terms of infrastructure and amenities, makes it an attractive option for those who work in Ahmedabad but want to live in a more peaceful and suburban setting. The property's furnished status and lack of amenities also appeal to buyers who prefer a simpler lifestyle and are not interested in paying extra for unnecessary features.

The ideal buyer may be:

* Profession",7,"24x7 Security, Power Backup, Lift, Garden, Kids Play Area, Parking, Gym","School, Main Road, Market","Luxury Living, Spacious Layout, Value for Money, Growing Area, Ready to Move","Road Facing, Vastu Compliant",4.53,Fair,45.2,68.51,Mid-Range & Emerging & Comfortable,"A well-established residential locality, developing area, moderately-sized properties","Small Families / Working Professionals, Upper-Middle Class, Apartment Seekers",Above Market - Overpriced,432.77,AVOID - Poor Quality or Overpriced,Ollama,AI-Generated,Ollama Local LLM,1
4,5.0,3285.0,Kankaria,Tier 2,365.0,11111.11,Apartment,Furnished,Ready to Move,"Nestled in the heart of Kankaria, Ahmedabad's most sought-after residential area, this stunning 5.0 BHK apartment offers an unparalleled blend of luxury, comfort, and convenience. With its strategic location, this property provides easy access to major commercial hubs, entertainment centers, and recreational areas, making it the ultimate abode for those seeking a hassle-free lifestyle. Standing out among other properties in the area, this apartment boasts of premium finishes, spacious living areas, and an opulent design that exudes sophistication and style. Whether you're looking to","Based on the provided information, here is a detailed investment analysis for the 5.0 BHK apartment in Kankaria:

Investment Potential: The property in Kankaria, a Tier 2 location, offers good investment potential due to its growing popularity and increasing demand for housing. The area has seen significant development in recent years, with new industries and infrastructure projects emerging, which is expected to further boost the local economy and attract more residents.

ROI Prospects: The property's price of ₹365.0 Lakhs and price per sqft of ₹11111 provide a good return on investment (ROI) compared to similar properties in the area. With a furnished apartment, the investor can expect a higher rental yield than an unfurnished property. However, the property's location in a Tier 2 area may limit its potential for","Kankaria, Ahmedabad offers several location advantages for homebuyers looking to purchase apartments in the area. Here are some of the key benefits: |  | 1. Connectivity: Kankaria is strategically located in the heart of Ahmedabad, providing easy access to various parts of the city. The area is well-connected to major transportation hubs such as the railway station and bus stand, making it convenient for residents to commute to work or travel to other parts of the city. | 2. Amenities: Kankaria is home to several amenities that cater to the needs of its residents. These include shopping malls, restaurants, schools, hospitals, and recreational facilities like parks and clubs. This makes it an attractive option for families and individuals who want to be close to amenities without sacrificing privacy or space. | 3. Affordability: Compared to other areas in Ahmedabad","The ideal buyer profile for this 5.0 BHK apartment in Kankaria (Tier 2) is likely to be professionals or entrepreneurs who are looking for a spacious and luxurious living space in a prime location. Specifically, the following groups may benefit most from this property:

1. Young professionals: The apartment's proximity to Kankaria (Tier 2) makes it an attractive option for young professionals who work in the area and are looking for a comfortable place to live after a long day at work.
2. Growing families: With five bedrooms and ample space, this apartment is ideal for growing families who",7,"24x7 Security, Power Backup, Lift, Water Supply, Gym, Parking, Kids Play Area","Hospital, Market, School","Luxury Living, Spacious Layout, Value for Money, Growing Area, Ready to Move","Corner Property, Vastu Compliant",4.78,Fair,47.8,222.5,Premium & Emerging & Spacious,"A high-end residential area, developing area, larger properties","Families, High-Income Buyers, Apartment Seekers",Above Market - Overpriced,64.04,AVOID - Poor Quality or Overpriced,Ollama,AI-Generated,Ollama Local LLM,1
5,4.0,3650.0,Sarkhej,Tier 3,360.0,9863.01,Apartment,Furnished,Ready to Move,"A rare gem in the heart of Sarkhej, Ahmedabad - This stunning 4 BHK apartment boasts an expansive 3650 sqft area, complete with premium finishes and top-notch fixtures. With its prime location in Tier 3, you'll enjoy easy access to all the amenities and attractions of the city, without sacrificing the peace and privacy that come with a quiet, upscale neighborhood. Whether you're a busy professional or a growing family, this beautiful home is sure to impress.","Based on the provided information, here is a detailed investment analysis for the 4.0 BHK apartment located in Sarkhej (Tier 3):

Investment Potential: The property's price of ₹360.0 Lakhs and area of 3650.0 sqft make it a reasonable investment opportunity, especially considering the location in a tier 3 area. However, the lack of amenities may impact its potential to attract high-end renters or buyers.

ROI Prospects: The property's price per sqft of ₹9863 could generate a decent return on investment (ROI) if rented out. However, the current rental market trends in Sarkhej may not provide significant returns, especially considering the lack of amenities.

Rental Demand: The demand for rentals in Sarkhej is","Sure! Here are some location advantages of Sarkhej in Ahmedabad: |  | 1. Proximity to the City Center: Sarkhej is located about 8-9 kilometers from the city center of Ahmedabad, making it an attractive option for those who want to be close to the heart of the city but avoid the noise and congestion of the central areas. The journey time from Sarkhej to the city center is around 20-30 minutes by car or public transport, depending on traffic conditions. | 2. Good Connectivity: Sarkhej is well-connected to the rest of Ahmedabad through a network of roads and public transportation. The area is served by several bus routes and is also accessible by taxis and ride-hailing services like Ola and Uber. The nearby Sabarmati Riverfront and the Gandhinagar Highway are major arterial roads that provide easy access","The ideal buyer profile for this 4.0 BHK apartment in Sarkhej (Tier 3) is likely to be professionals or families who are looking for a spacious and well-appointed home in a rapidly developing area. The property's location offers easy access to various amenities, including restaurants, schools, and hospitals, making it an attractive option for young professionals with growing families. Additionally, the property's furnished status and lack of amenities make it an ideal choice for those who prefer a hassle-free living experience without the burden of maintenance costs.",5,"24x7 Security, Power Backup, Lift, Water Supply, Garden","Highway, Market","Luxury Living, Spacious Layout, Value for Money, Growing Area, Ready to Move","Vastu Compliant, Corner Property",4.53,Fair,45.2,87.84,Mid-Range & Active & Comfortable,"A well-established residential locality, good market activity, moderately-sized properties","Small Families / Working Professionals, Upper-Middle Class, Apartment Seekers",Above Market - Overpriced,309.84,AVOID - Poor Quality or Overpriced,Ollama,AI-Generated,Ollama Local LLM,1
6,4.0,2300.0,Ambawadi,Tier 1,360.0,15652.17,Apartment,Furnished,Ready to Move,"Indulge in the luxury of this spacious 4.0 BHK apartment in the heart of Ambawadi, Ahmedabad. With an area of 2300.0 sqft and a price tag of ₹360.0 Lakhs, this property offers a unique blend of style, comfort, and convenience. Located in a prime Tier 1 locality, it is ready to move-in and promises a hassle-free living experience with its modern amenities and well-maintained surroundings. Whether you're looking for a peaceful retreat or an investment opportunity, this property is sure to impress.","Based on the provided information, here is a detailed investment analysis for the 4.0 BHK apartment located in Ambawadi, Ahmedabad:

Investment Potential: The property's price of ₹360.0 Lakhs and area of 2300.0 sqft make it a relatively affordable option in the tier-1 location of Ambawadi. However, the lack of amenities may limit its appeal to potential buyers, especially those looking for a luxurious living experience.

ROI Prospects: The property's price per sqft of ₹15652 is relatively low compared to other properties in the area, which could indicate a potential for capital appreciation in the future. However, this will depend on various factors such as the overall real estate market trends and the demand for housing in Ambawadi.

Rental Demand: The property","Ambawadi, located in the heart of Ahmedabad, offers several location advantages that make it an attractive choice for homebuyers. Here are some of the key benefits: |  | 1. Strategic Location: Ambawadi is situated in a prime location in Ahmedabad, with easy access to major transportation hubs, commercial centers, and entertainment options. The area is well-connected to the rest of the city through a network of roads, railways, and public transportation, making it convenient for residents to commute to work or other destinations. | 2. Growing Economic Activity: Ambawadi is located in close proximity to several major industrial parks and business centers in Ahmedabad, including the Sabarmati IT Park, the Gujarat University Campus, and the Sarkhej-Gandhi Nagar area. This growing economic activity creates a range of job opportunities for residents,","The ideal buyer profile for this 4.0 BHK apartment in Ambawadi (Tier 1) is likely to be affluent professionals or entrepreneurs who are looking for a spacious and luxurious living space in a prime location. These buyers may be aged between 35-55 years old, have a high-income level, and value privacy and exclusivity. They may also prioritize convenience and accessibility, with easy connectivity to major commercial and entertainment hubs in the city.",10,"24x7 Security, Power Backup, Lift, Clubhouse, Landscaped Garden, Kids Play Area, Visitor Parking, CCTV, Swimming Pool, Intercom","School, Metro Station, IT Park, Shopping Mall","Luxury Living, Spacious Layout, Prime Location, Well Connected, Ready to Move","Vastu Compliant, North Facing",4.53,Fair,45.2,163.09,Premium & Emerging & Spacious,"A high-end residential area, developing area, larger properties","Families, High-Income Buyers, Apartment Seekers",Above Market - Overpriced,120.74,AVOID - Poor Quality or Overpriced,Ollama,AI-Generated,Ollama Local LLM,1
7,4.0,3168.0,Science City,Tier 2,359.0,11332.07,Apartment,Furnished,Under Construction,"Indulge in the luxury of having it all with this stunning 4 BHK apartment in Science City, Ahmedabad! Boasting an impressive area of 3168 sqft, this under-construction property offers an unparalleled living experience with its strategic location, premium fittings, and top-notch amenities. Whether you're a working professional or a family looking for a comfortable home, this property has everything you need to live life on your terms. So why wait? Make this incredible investment opportunity yours today!","Based on the provided information, here is a detailed investment analysis for the 4 BHK apartment located in Science City (Tier 2):

Investment Potential: The property offers good investment potential due to its strategic location in a rapidly developing area. The demand for apartments in this locality is expected to increase in the coming years, driven by the growth of the IT sector and the expansion of nearby industries. As a result, the property is likely to appreciate in value over time, providing a good long-term investment opportunity.

ROI Prospects: The property's price of ₹359.0 Lakhs and price per square foot of ₹11332 offer a reasonable return on investment (ROI) compared to similar properties in the area. Assuming an annual rental income of ₹25,000 per month, the property's ROI would","Sure! Here are the location advantages of Science City, Ahmedabad: |  | 1. Proximity to Knowledge Hubs: Science City is strategically located in close proximity to several knowledge hubs, including the Indian Institute of Management (IIM) and the National Institute of Design (NID), both of which are renowned for their academic excellence. This provides residents with easy access to a pool of skilled professionals and a vibrant intellectual environment. | 2. Easy Commute: Science City is located on the outskirts of Ahmedabad, which makes it easier for residents to commute to other parts of the city for work or leisure. The area is well-connected via road and public transportation, reducing the need for personal vehicles and minimizing traffic congestion. | 3. Growing Economic Activity: Science City is located in a rapidly developing economic zone, with several major industries setting up operations","The ideal buyer profile for this 4.0 BHK apartment in Science City (Tier 2) is likely to be professionals or families who are looking for a spacious and well-appointed home in a prime location. The furnished property offers three amenities, including a gym, swimming pool, and children's play area, which would appeal to busy professionals who value convenience and comfort. The Science City location provides easy access to various workplaces, educational institutions, and recreational facilities, making it an ideal choice for working couples or families with school-going children.",7,"24x7 Security, Power Backup, Lift, Kids Play Area, Water Supply, Garden, Parking","Main Road, Hospital, School","Luxury Living, Spacious Layout, Value for Money, Growing Area, Ready to Move","Road Facing, Vastu Compliant",5.03,Fair,50.2,193.84,Premium & Emerging & Spacious,"A high-end residential area, developing area, larger properties","Families, High-Income Buyers, Apartment Seekers",Above Market - Overpriced,85.2,AVOID - Poor Quality or Overpriced,Ollama,AI-Generated,Ollama Local LLM,1
