Property_ID,BHK,Area_SqFt,Locality,Locality_Tier,Price_Lakhs,Price_Per_SqFt,Property_Type,Furnishing_Status,Construction_Status,Property_Overview,Investment_Analysis,Location_Advantages,Target_Buyers,Total_Amenities,Amenities,Nearby_Features,Selling_Points,Views_Facing,Quality_Score,Quality_Rating,Quality_Out_Of_100,Locality_Avg_Price,Locality_Character,Locality_Description,Ideal_For,Market_Position,Price_vs_Market_Percent,Investment_Recommendation,AI_Model,Analysis_Type,Content_Source,Batch_Number
8,4.0,3168.0,Science City,Tier 2,359.0,11332.07,Apartment,Furnished,Under Construction,"Nestled in the heart of Science City, Ahmedabad's most premier real estate destination, this 4.0 BHK apartment offers an unparalleled living experience. With its strategic location, this property boasts easy access to top-notch educational institutions, hospitals, and commercial hubs, making it the perfect choice for families and professionals alike. What sets this property apart is its unique blend of modern amenities, spacious layout, and meticulously designed interiors, creating a luxurious lifestyle that's hard to find in today's market.","Based on the provided information, here is a detailed investment analysis for the 4.0 BHK apartment in Science City (Tier 2):

Investment Potential: The property offers good investment potential due to its strategic location in Science City, which is a rapidly growing area with increasing demand for residential properties. The price of ₹359.0 Lakhs is relatively affordable compared to other properties in the area, making it an attractive investment option.

ROI Prospects: With a price per square foot of ₹11332, the property offers a potential return on investment (ROI) of around 6-7% per year, assuming a rent of ₹25000-30000 per month. The rental yield is decent and can provide a steady income stream for investors.

Rental Demand: Science City is","Ahmedabad's Science City is a popular residential area known for its proximity to various educational institutions and employment opportunities. Here are some location advantages of living in Science City, Ahmedabad: |  | 1. Close Proximity to Educational Institutions: Science City is located in close proximity to several reputed educational institutions such as the Indian Institute of Management (IIM), National Institute of Design (NID), and the Indian Institute of Technology (IIT). This makes it an ideal location for professionals and students who want to be close to their workplace or institution without sacrificing privacy and comfort. | 2. Access to Employment Opportunities: Science City is located in the heart of Ahmedabad, which provides easy access to various employment opportunities across different industries. The area is home to several multinational companies, IT parks, and business centers, making it an attractive location for professionals","The ideal buyer profile for this 4.0 BHK apartment in Science City (Tier 2) is likely to be professionals, entrepreneurs, or families who are looking for a spacious and well-appointed home in a prime location. The property's proximity to the city center and major office hubs makes it an attractive option for working individuals who want to be close to their workplace while enjoying the benefits of a peaceful living environment. Additionally, the property's furnished status and presence of amenities such as a gym, swimming pool, and children's play area make it an appealing choice for families with young children or those who value convenience",7,"24x7 Security, Power Backup, Lift, Gym, Parking, Kids Play Area, Water Supply","Hospital, Market, Main Road","Luxury Living, Spacious Layout, Value for Money, Growing Area, Ready to Move","Park View, East Facing",5.03,Fair,50.2,193.84,Premium & Emerging & Spacious,"A high-end residential area, developing area, larger properties","Families, High-Income Buyers, Apartment Seekers",Above Market - Overpriced,85.2,AVOID - Poor Quality or Overpriced,Ollama,AI-Generated,Ollama Local LLM,1
9,4.0,3168.0,Science City,Tier 2,359.0,11332.07,Apartment,Furnished,Under Construction,"Nestled in the heart of Science City, Ahmedabad's most premier residential complex, this stunning 4 bedroom, 4 bathroom apartment offers unparalleled luxury and comfort. With its strategic location, this property boasts of easy access to top-notch educational institutions, world-class healthcare facilities, and a range of recreational activities. The under construction project is set to be a marvel in modern living, with cutting-edge amenities and state-of-the-art security measures, ensuring a safe and secure lifestyle for you and your family. Don't miss out on this rare opportunity to own a piece of paradise in the thriving","Based on the provided information, here is a detailed investment analysis for the 4.0 BHK apartment located in Science City (Tier 2):

Investment Potential: The property's location in a rapidly developing area with access to major infrastructure and amenities presents a strong investment potential. The price of ₹359.0 Lakhs for a 3168.0 sqft apartment is relatively affordable compared to similar properties in the area, making it an attractive option for investors.

ROI Prospects: With the increasing demand for housing in Science City (Tier 2), the property is likely to appreciate in value over time, providing a strong return on investment (ROI) prospect. According to recent trends, properties in this area have been appreciating at an average rate of 10-15% per annum, which could result in a significant","Ahmedabad's Science City is a hub of innovation and technology, offering several location advantages for residents. Here are three to four key advantages: |  | 1. Access to a Talented Workforce: As a Tier 2 city, Ahmedabad has a relatively lower cost of living compared to other metro cities in India. This makes it an attractive destination for businesses and startups looking to hire talented professionals at competitive salaries. Residents of Science City can easily access a pool of skilled workers, which can be beneficial for both personal and professional growth. | 2. Proximity to Industrial Estates: Science City is located close to several industrial estates in Ahmedabad, such as the Gujarat Industrial Development Corporation (GIDC) Estate and the Sabarmati Estate. This proximity offers easy access to various industries, including manufacturing, textiles, pharmaceuticals,","The ideal buyer profile for this 4.0 BHK apartment in Science City (Tier 2) is likely to be professionals or families with middle to upper-middle class income levels who are looking for a spacious and well-appointed living space within a convenient location. The property's proximity to amenities such as schools, hospitals, and shopping centers will also appeal to parents with young children or those who value easy access to essential services. Additionally, the furnished units and 3 amenities offered by the property may attract busy professionals or families who want a hassle-free living experience without having to worry about furnishing or maintenance tasks.",7,"24x7 Security, Power Backup, Lift, Water Supply, Kids Play Area, Parking, Garden","Hospital, School, Market","Luxury Living, Spacious Layout, Value for Money, Growing Area, Ready to Move","Corner Property, North Facing",5.03,Fair,50.2,193.84,Premium & Emerging & Spacious,"A high-end residential area, developing area, larger properties","Families, High-Income Buyers, Apartment Seekers",Above Market - Overpriced,85.2,AVOID - Poor Quality or Overpriced,Ollama,AI-Generated,Ollama Local LLM,1
